"count_date","location_id","location","daily_sb_cars_t","daily_nb_cars_t","daily_wb_cars_t","daily_eb_cars_t","daily_sb_bus","daily_nb_bus","daily_wb_bus","daily_eb_bus","daily_nx_peds","daily_sx_peds","daily_ex_peds","daily_wx_peds","daily_nx_bike","daily_sx_bike","daily_ex_bike","daily_wx_bike"
"2016-12-06",5997,"BRIDLETOWNE CIR E AT FINCH AVE E",565,500,6011,6556,0,1,0,0,268,210,94,145,0,0,9,7
"2016-12-06",36206,"HUGO AVE AT PERTH AVE",23,21,0,0,0,0,0,0,43,32,0,1,0,0,6,7
"2016-12-07",4020,"BIRCHMOUNT RD AT L AMOREAUX DR & SILVER SPRINGS BLVD (PX 1167)",5821,4751,284,283,0,1,0,0,194,109,73,258,3,6,4,4
"2016-12-07",5273,"BIRCHMOUNT RD AT MCNICOLL AVE (PX 1413)",4311,3445,5238,4671,1,2,2,2,81,53,57,92,13,6,4,6
"2016-12-07",5796,"BIRCHMOUNT RD AT FUNDY BAY BLVD & IVY BUSH AVE (PX 1550)",5066,4232,51,37,1,0,0,1,51,30,26,21,1,6,6,4
"2016-12-07",6029,"ALLANFORD RD AT BIRCHMOUNT RD & SCARDEN AVE (PX 1357)",7053,5950,51,64,0,0,0,2,30,38,20,25,0,4,0,0
"2016-12-07",6732,"# 2450 BIRCHMOUNT RD AT STEPHEN LEACOCK CI (PX 1026)",7425,6181,0,0,0,0,0,1,79,64,0,146,6,10,2,0
"2016-12-07",14883,"BIRCHMOUNT RD AT GLENDOWER CRCT & TIMBERBANK BLVD (PX 1165)",5818,4865,20,20,1,0,2,0,82,28,62,41,8,10,0,1
"2016-12-07",24765,"BIRCHMOUNT RD AT STALEY TER (PX 2165)",5644,4614,0,0,0,0,0,0,8,21,0,24,5,4,0,4
"2016-12-08",38093,"BEECHBOROUGH AVE AT BERTRAM ST",7,12,1811,1961,0,0,0,0,43,16,2,17,0,0,2,1
"2016-12-10",4214,"BIRCHMOUNT RD AT LAWRENCE AVE (PX 410)",3563,3662,6857,6279,0,1,0,1,178,416,194,337,1,1,0,1
"2016-12-10",4480,"BIRCHMOUNT RD AT HUNTINGWOOD DR (PX 987)",4231,3527,1649,1531,0,0,0,0,36,25,38,63,6,1,3,1
"2016-12-10",4526,"MCNICOLL AVE AT MIDLAND AVE (PX 1540)",3680,3530,4011,3379,1,0,0,0,145,159,218,181,14,10,11,5
"2016-12-10",4545,"PHARMACY AVE AT ST CLAIR AVE E (PX 472)",2141,2359,4879,5000,0,1,0,0,123,77,87,51,2,2,7,0
"2016-12-10",4546,"MIDLAND AVE AT ST CLAIR AVE (PX 476)",1253,1219,3214,2939,0,0,0,0,57,117,95,64,1,5,4,3
"2016-12-10",4928,"BRIMLEY RD AT ST CLAIR AVE E (PX 497)",926,940,2791,2568,0,0,0,1,93,156,89,204,3,1,5,2
"2016-12-10",5273,"BIRCHMOUNT RD AT MCNICOLL AVE (PX 1413)",2844,2413,3907,3858,0,2,0,0,24,17,12,41,5,2,4,1
"2016-12-10",5621,"KENNEDY RD AT ST CLAIR AVE (PX 475)",1609,1507,4429,4392,0,0,0,1,101,67,64,76,0,3,8,3
"2016-12-10",5838,"BRIMLEY RD AT PROGRESS AVE (PX 1072)",2232,2114,5439,5806,0,0,0,0,10,34,39,27,2,0,0,0
"2016-12-10",12179,"PARKSIDE DR AT SPRING RD (PX 1806)",6904,5989,0,0,0,0,0,0,155,31,0,51,3,6,0,3
"2016-12-13",5589,"DIXON AVE AT DUNDAS ST E & KINGSTON RD",3424,2640,216,0,4,0,0,1,177,132,106,245,3,6,2,2
"2016-12-13",28053,"CEDARVALE AV AT COSBURN AV (PX 2462)",63,67,1189,1161,3,0,2,0,110,83,191,42,1,1,5,4
"2016-12-13",30310,"BIRCHMOUNT RD AT VAUXHALL DR (PX 2102)",7891,7267,0,0,0,0,2,0,67,153,159,0,2,2,0,0
"2016-12-14",4911,"MIDLAND AVE AT SILVER STAR BLVD & SOUTH SHIELDS AVE (PX 1494)",4633,3864,222,126,1,1,0,2,239,215,132,212,11,5,7,0
"2016-12-14",4912,"BROADBENT AVE AT MIDLAND AVE & WAINFLEET RD (PX 1719)",4603,4346,18,12,0,0,1,0,79,218,145,217,2,2,0,0
"2016-12-14",4937,"HERRON AVE AT ST CLAIR AVE (PX 641)",13,7,6690,6655,0,1,0,0,108,56,145,22,1,0,0,3
"2016-12-14",5323,"MARCOS BLVD AT MIDLAND AVE & ROMULUS DR (PX 1098)",4787,4561,36,35,1,0,1,0,129,158,152,85,5,2,0,0
"2016-12-14",5341,"PLAXTON DR AT ST CLAIR AVE (PX 1681)",0,0,5591,5302,0,0,0,1,0,111,44,91,0,2,0,4
"2016-12-14",5828,"MIDLAND AVE AT STANSBURY CR (PX 1080)",4770,4448,0,0,0,1,2,0,5,177,194,0,2,1,1,0
"2016-12-14",5841,"BRIMLEY RD AT PORT ROYAL S TR & WENLOCK GT (PX 1567)",4512,3934,76,63,0,0,0,0,67,30,22,16,5,3,2,2
"2016-12-14",5846,"LINDEN AVE AT ST CLAIR AVE (PX 1283)",1,2,4837,4675,1,0,0,0,20,79,62,35,0,0,2,2
"2016-12-14",6274,"BAYLAWN DR AT BOARHILL DR & MIDLAND AVE (PX 1896)",4794,4508,16,34,0,0,0,0,75,48,87,63,5,6,0,0
"2016-12-14",6848,"ANSON AVE AT BRIMLEY RD & COMRIE TERR (PX 2169)",2105,2314,11,11,0,2,0,1,60,41,74,56,1,2,0,0
"2016-12-14",11771,"BIRCHMOUNT RD AT MODERN RD (PX 2100)",6535,6664,0,0,1,0,0,0,74,25,0,50,1,1,0,0
"2016-12-14",11901,"HAVENDALE RD AT MIDLAND AVE (PX 2032)",5284,4918,160,188,0,1,0,2,18,50,41,46,4,3,1,4
"2016-12-14",31835,"MIDLAND AVE AT 175M N OF MCNICOLL AVE (PX 2091)",4634,4419,0,0,0,0,0,0,40,30,0,119,1,8,0,0
"2016-12-14",31905,"# 111 PROGRESS AVE AT ATLANTIC PACKAGING (PX 2221)",0,0,5788,4693,0,0,0,0,14,0,353,47,0,0,1,0
"2016-12-14",33574,"BIRCHMOUNT RD AT FLORA DR (PX 2260)",6764,6452,0,0,0,2,0,0,53,39,80,0,0,0,0,1
"2016-12-14",38098,"SOUTHILL DR AT THE DONWAY W",0,0,872,894,0,2,0,0,7,2,19,10,0,0,0,2
"2016-12-15",4542,"BRIMLEY RD AT DORCOT AVE (PX 1282)",5774,5224,0,0,5,0,0,2,13,112,0,31,1,0,0,0
"2016-12-15",4544,"BRIMLEY RD AT PITFIELD RD (PX 1551)",5501,4822,791,509,0,1,2,2,90,34,104,73,1,0,1,0
"2016-12-15",6854,"BRIMLEY RD AT HEATHER RD (PX 1639)",6927,5590,0,0,1,0,0,2,2,51,0,19,3,1,0,1
"2016-12-15",12200,"BRIMLEY RD AT 250M S OF SHEPPARD (PX 1749)",6099,5571,0,0,0,0,0,0,13,0,0,0,1,0,0,0
"2016-12-15",36662,"BRIMLEY RD AT 170M SOUTH OF HUNTINGWOOD DR (PX 2308)",6342,4979,0,0,0,1,2,0,74,36,38,0,2,1,0,0
"2016-12-29",27196,"CLONMORE DR AT QUEENSBURY AVE",0,0,2724,2418,0,1,0,0,0,54,23,1,0,1,0,2
"2017-01-07",4423,"HIGHWAY 401 S TCS AT RENFORTH DR (PX 925)",1387,2655,0,42,0,0,0,1,0,0,1,0,1,0,0,0
"2017-01-07",4681,"LAWRENCE AVE E AT MOUNT PLEASANT RD E (PX 142)",585,482,2173,2208,0,1,0,0,36,40,21,18,0,1,0,2
"2017-01-07",4720,"LAIRD DR AT MCRAE DR & WICKSTEED AVE (PX 681)",3199,3636,1142,1659,0,0,0,0,106,212,319,114,3,5,0,3
"2017-01-07",4931,"BRIMLEY RD AT MCNICOLL AVE (PX 1510)",3221,2971,3291,2855,0,1,1,2,46,20,46,33,0,0,0,0
"2017-01-07",5945,"BROADWAY AVE AT MOUNT PLEASANT RD (PX 139)",3906,4083,675,721,0,0,0,1,176,122,265,250,2,6,1,2
"2017-01-14",5053,"MOORE AVE AT MOUNT PLEASANT RD (PX 135)",4482,4564,94,92,0,0,0,0,23,62,61,91,8,14,5,0
"2017-01-16",4681,"LAWRENCE AVE E AT MOUNT PLEASANT RD E (PX 142)",994,954,3206,3296,1,0,0,1,127,97,24,42,1,3,4,3
"2017-01-17",5454,"MERTON ST AT MOUNT PLEASANT RD",6071,6084,1426,1179,0,0,0,0,243,111,166,224,9,4,4,0
"2017-01-17",5721,"INGLEWOOD DR AT MOUNT PLEASANT RD (PX 133)",6733,7210,100,161,0,0,0,0,265,0,211,17,5,4,6,2
"2017-01-18",6121,"GREENWOOD AVE AT MEMORIAL PARK AVE",1998,1056,188,119,0,0,2,0,36,25,32,55,3,8,7,7
"2017-01-19",5089,"MORNINGSIDE AVE AT WARNSWORTH ST",5299,4914,0,0,3,0,0,2,17,3,0,262,3,1,0,3
"2017-01-19",5946,"MOUNT PLEASANT RD AT ST LEONARDS AVE (PX 141)",4434,4925,362,180,0,1,0,0,68,38,40,40,0,1,0,3
"2017-01-30",4504,"DANCY AVE AT KENNEDY RD",7072,6466,0,0,1,1,0,1,30,3,1,80,14,3,0,0
"2017-01-31",4881,"COLLINGWOOD ST AT JADE ST & KENNEDY RD",10742,9247,2,2,1,0,0,0,9,3,121,116,3,3,0,0
"2017-02-02",20279,"GOODWILL AVE AT WILSON HEIGHTS BLVD",2852,3580,11,12,0,0,0,0,13,60,18,8,3,0,0,0
"2017-02-02",32384,"SAMMON AVE AT WOODBINE AVE",3556,4078,25,38,1,0,0,1,27,33,207,230,13,8,1,3
"2017-02-02",38151,"BROADVIEW AVE AT FERNWOOD GNDS",2873,2692,0,0,0,0,0,1,3,23,0,54,18,11,0,0
"2017-02-02",38152,"BROADVIEW AVE AT WOODVILLE AVE",2858,2677,0,0,0,0,0,0,29,10,47,0,19,12,1,0
"2017-02-06",6135,"COURAGE AVE AT JANE ST",6226,5269,2,0,0,0,1,0,4,6,112,0,2,1,0,1
"2017-02-08",35406,"BARKER AVE AT COXWELL AVE",3232,3646,0,0,0,0,0,0,48,46,135,5,5,5,0,0
"2017-02-09",4375,"PORT UNION RD AT ROZELL RD",5268,5445,0,0,1,0,0,1,1,2,8,70,0,2,0,0
"2017-02-13",12086,"MIDDLEFIELD RD AT RICHMOND PARK BLVD (PX 2483)",3645,3627,2,6,1,0,0,0,16,10,5,16,2,2,0,0
"2017-02-13",31149,"MILNER AVE AT NOVOPHARM CRT",0,0,4209,2447,0,0,0,0,36,37,4,8,0,0,1,1
"2017-02-14",38127,"GOLDCREST BLVD AT LAWRENCE AVE W",1,2,8714,6972,0,0,2,0,128,175,19,9,0,0,3,1
"2017-02-15",31107,"BELLAMY RD N AT EASTPARK BLVD (PX 2493)",2690,3195,0,0,0,2,1,0,4,3,54,44,2,0,0,0
"2017-02-15",38120,"EDITH DR AT MONTGOMERY AVE",648,706,0,0,0,1,2,0,69,63,58,23,14,12,10,0
"2017-02-15",38121,"EDITH DR AT HELENDALE AVE",961,938,0,0,0,0,0,0,31,19,8,4,14,13,0,0
"2017-02-15",38128,"DUFFERIN ST AT GLENGROVE AVE (PX 2471)",7732,7248,0,0,0,0,0,0,43,28,0,244,0,0,2,2
"2017-02-21",38124,"ANTLER ST AT CAMPBELL AVE",405,250,0,0,0,0,0,0,63,48,53,0,9,9,0,0
"2017-02-22",4751,"FINCH AVE AT WILLOWDALE AVE (PX 807)",3276,2728,6786,6418,0,1,2,2,174,173,189,105,8,7,3,3
"2017-02-22",5060,"CUMMER AVE AT MAXOME AVE (PX 1557)",724,448,2800,2617,0,0,0,1,49,74,92,70,4,3,4,5
"2017-02-22",38123,"DORIS AVE AT NORTHTOWN WAY",3388,3086,0,0,0,0,0,0,50,66,0,333,1,4,0,0
"2017-02-23",38027,"HIGH MEADOW PL AT SIGNET DR",4049,3763,1,2,0,0,0,0,5,9,3,44,6,4,0,0
"2017-02-27",4083,"OLD WESTON RD AT ROCKWELL AVE (PX 2562)",2570,3827,0,0,0,0,1,0,59,65,89,0,0,0,0,0
"2017-03-02",36715,"INDIAN GRV AT RIDOUT ST",66,103,123,469,3,1,1,1,83,71,96,73,0,1,2,2
"2017-03-02",38143,"ESTHER LORRIE DR AT KIPLING AVE",4773,4209,0,0,2,0,0,1,27,5,0,96,0,1,0,4
"2017-03-06",4860,"EVANS AVE AT GAIR DR (PX 1310)",0,1,4321,4305,0,1,1,2,73,83,95,0,0,1,6,7
"2017-03-06",11213,"REESOR RD W AT STEELES AVE E",0,0,3332,3304,0,2,0,0,0,0,0,0,0,1,1,0
"2017-03-06",30714,"BIRDSTONE CRES AT WESTON RD NTCS (PX 2141)",7227,5054,24,28,0,0,0,0,100,119,73,159,11,11,3,1
"2017-03-06",38146,"EGLINTON AVE E AT HUNTINGTON AVE",0,0,9213,7898,0,0,0,2,181,116,29,53,0,0,8,7
"2017-03-08",5898,"BATHURST ST AT GLENGROVE AVE",7618,7961,7,14,0,0,0,0,49,43,150,26,7,3,2,0
"2017-03-09",5714,"BROOKVIEW DR AT LAWRENCE AVE W (PX 2532)",0,0,7798,6666,0,0,1,0,203,0,14,43,3,0,3,4
"2017-03-20",4267,"CHAMPLAIN BLVD AT WILSON AVE",0,0,5911,6229,0,0,0,1,0,65,0,0,1,5,0,0
"2017-03-23",38086,"BLOOR ST W AT TREMONT RD",0,0,4873,6125,0,0,0,0,0,30,26,9,0,0,5,6
"2017-03-27",38163,"BRUNELLO GATE AT MARTIN GROVE RD",2955,3031,0,0,0,0,0,0,42,44,0,56,4,1,0,0
"2017-03-27",38169,"HARWOOD RD. AT MANOR RD. E",0,0,967,936,0,1,0,1,0,160,23,20,0,3,7,2
"2017-03-29",38165,"BATHURST ST AT YORKVIEW DR",8214,8437,5,0,0,0,1,0,53,44,196,0,8,4,0,0
"2017-03-30",6323,"SYLLA AVE AT WARDEN AVE",10633,8982,0,0,1,0,0,1,14,14,0,34,4,2,0,0
"2017-04-03",38171,"GAILONG CRES AT PARKWOODS VILLAGE DR",0,0,6028,6213,0,0,0,0,0,0,57,77,0,0,5,4
"2017-04-04",6606,"LAWRENCE AVE E AT TOWNLEY AVE",0,0,10052,9477,0,0,0,1,0,0,18,16,1,0,5,6
"2017-04-04",38170,"ANDREW AVE AT ST CLAIR AVE E",0,0,4322,4662,0,0,0,0,21,3,54,23,1,0,1,2
"2017-04-05",32672,"ARROW RD AT DEERHIDE CRES (SOUTH INT)",2732,2726,0,0,1,0,0,2,1,0,1,56,2,2,0,0
"2017-04-05",38176,"MARKHAM RD AT ROSEBANK DR",9234,10310,0,0,0,0,1,0,49,25,135,0,4,2,0,0
"2017-04-06",4194,"AVENUE RD AT LYTTON BLVD (PX 1769)",10042,9207,0,0,1,0,0,0,63,33,0,32,2,0,0,4
"2017-04-06",5006,"AVENUE RD AT STRATHALLAN BLVD",10393,9592,0,0,0,0,0,1,0,0,0,45,2,1,0,0
"2017-04-06",5416,"AVENUE RD AT GLENCAIRN AVE",9904,9033,69,73,0,0,1,0,2,2,41,36,2,2,0,2
"2017-04-06",5923,"AVENUE RD AT ROSELAWN AVE (PX 1030)",8993,7395,987,1134,2,0,2,2,210,313,162,255,3,3,4,7
"2017-04-06",6196,"AVENUE RD AT CORTLEIGH BLVD",9877,9116,20,17,0,0,1,0,0,1,49,33,2,1,0,0
"2017-04-06",6436,"AVENUE RD AT KELWAY BLVD",9413,7572,0,0,0,0,0,0,3,7,0,102,2,4,0,0
"2017-04-06",32320,"AVENUE RD AT 150M S OF CARIBOU &  HAVERGALL COLLEGE (PX 1678)",10351,9678,0,0,0,0,0,0,0,21,58,0,1,5,0,0
"2017-04-06",38008,"AVENUE RD AT CARIBOU RD",10278,9653,6,2,0,0,0,0,0,5,121,103,1,2,0,0
"2017-04-06",38175,"AVENUE RD AT GLENVIEW AVE",10375,9934,0,0,0,0,0,0,0,1,57,0,2,4,2,0
"2017-04-12",38199,"BILLY BISHOP WAY AT 400M E OF DUFFERIN ST (COSTCO DRIVEWAY)",0,0,1153,2025,1,0,0,0,2,0,0,0,0,0,2,4
"2017-04-25",29521,"BIRCHMOUNT RD AT ZENITH DR",2882,2939,1,0,0,0,1,0,94,17,179,300,1,0,2,0
"2017-05-01",4724,"MALVERN ST AT PROGRESS AVE & SHEPPARD AVE (PX 1568)",1595,1125,6491,4865,0,1,0,1,320,350,345,322,0,0,0,0
"2017-05-02",28980,"ISLINGTON AVE AT ST GEORGE BLVD",8188,11226,0,0,4,0,0,2,0,4,0,55,6,2,0,0
"2017-06-05",6449,"PROGRESS AVE AT WILLIAM KITCHEN RD (PX 1702)",0,0,4416,2737,0,0,0,0,161,0,56,221,0,0,0,0
"2017-06-06",6264,"SHEPPARD AVE E AT TWYN RIVERS DR",0,0,2541,2589,0,0,0,0,4,0,0,2,2,0,3,2
"2017-06-06",12100,"CEDARVALE AVE AT HOLBORNE AVE",87,82,36,38,0,1,0,0,34,31,73,45,5,7,1,3
"2017-06-08",30720,"MCNICOLL AVE AT SILVER STAR BLVD (PX 1958)",5,1,5252,4560,0,0,2,1,68,57,61,65,0,0,8,2
"2017-06-14",12260,"DOVERCOURT RD AT GEARY AVE (PX 2469)",2256,1609,396,649,1,0,0,0,68,46,99,89,0,0,0,0
"2017-06-22",34915,"GARDENTREE ST AT MORNINGSIDE AVE AND PIXLEY CRES",1634,1583,16,10,1,0,0,0,0,0,61,25,14,13,1,0
"2017-06-22",38554,"DALBEATTIE AVE AT GARY DR",0,0,356,536,0,0,0,0,24,40,19,6,1,0,1,3
"2017-06-29",38532,"ELDER ST AT WATERLOO AVE",71,35,68,78,0,0,0,0,13,14,16,27,0,0,1,2
"2017-07-06",37989,"CHAMBERS AVE AT ROGERS RD",27,25,3697,3017,0,0,0,0,224,191,145,55,0,0,0,0
"2017-07-10",4302,"CARLAW AVE AT LANEWAY 75M N OF LAKE SHORE BLVD E",3724,3440,0,0,0,0,0,0,27,31,3,97,0,3,3,1
"2017-07-10",12217,"BERWICK AVE AT DUPLEX AVE",3121,2814,0,0,0,0,0,0,11,30,36,1,0,0,6,1
"2017-07-10",26672,"CASSANDRA BLVD AT UNDERHILL DR",1889,1556,205,287,0,0,0,0,100,127,131,103,0,3,0,1
"2017-07-11",23973,"MILNER AVE AT MURISON BLVD (PX 1942)",413,0,2809,2112,3,0,0,0,212,211,261,158,0,0,0,0
"2017-07-11",38481,"CHESSWOOD DR AT VANLEY CRES SOUTH SIDE",3745,3916,0,0,0,0,0,0,6,20,8,0,0,3,0,1
"2017-07-18",38560,"DERRYDOWN RD AT GRANDRAVINE DR",0,0,979,1224,0,0,1,0,69,0,0,0,1,3,11,3
"2017-07-19",6433,"NEWGALE GT AT TAPSCOTT RD (PX 1790)",2522,3674,18,55,0,0,0,0,4,37,34,23,0,0,0,0
"2017-07-24",11342,"EAGLE POINT AT MCNICOLL AVE (PX 1815)",0,0,4251,3998,0,0,0,0,47,1,24,49,0,1,0,0
"2017-08-01",38535,"DENGATE RD AT LN N OF GERRARD W OF DENGATE",733,549,0,1,0,0,0,0,15,13,107,49,13,11,1,2
"2017-08-02",38563,"PELLATT AVE AT WENDELL AVE",1258,1123,54,32,0,0,0,0,0,0,45,24,20,8,6,6
"2017-08-16",38628,"ATTWELL DR AT FARNBORO RD",1489,1641,15,8,0,2,0,0,5,7,70,62,0,4,0,0
"2017-08-25",26672,"CASSANDRA BLVD AT UNDERHILL DR",1827,1490,183,280,0,0,0,0,103,117,124,87,0,3,0,1
"2017-09-06",6309,"ATHOL AVE AT ISLINGTON AVE & NORDIN AVE (PX 2470)",6901,7389,6,13,4,1,2,1,3,4,74,112,15,10,2,3
"2017-09-19",4732,"FRANCINE DR AT LESLIE ST",6728,5983,3,0,0,0,0,0,2,8,69,120,2,3,2,1
"2017-09-19",38667,"HILLCREST AVE AT WILLOWDALE AVE",4261,3206,98,89,0,0,0,0,41,8,52,41,17,14,8,3
"2017-09-27",38737,"BRITTANY CRT AT ROYAL YORK ROAD",4512,4137,0,1,0,0,0,0,0,0,52,89,24,13,0,0
"2017-09-28",38721,"ALFRED AVE AT WILLOWDALE AVE",3951,3372,41,14,1,0,2,0,16,28,67,76,15,6,2,1
"2017-09-28",38766,"LANGBOURNE PL AT THE DONWAY W/CONDO DRIVEWAY",3514,1900,2,12,0,0,0,0,49,74,223,195,11,6,3,0
"2017-10-03",38814,"BAMBURGH CIR AT FUNDY BAY BLVD",261,247,90,46,0,2,2,0,387,58,426,228,3,6,8,2
"2017-10-03",38815,"BRAYWIN DR AT ST PHILLIPS RD",5390,6433,0,0,0,0,0,1,0,0,0,13,13,9,0,0
"2017-10-04",38724,"BROWNS LINE AT DOVER DR",5056,4684,3,1,1,0,0,1,2,5,52,100,18,11,0,2
"2017-10-10",30684,"LAVINIA AVE AT MORNINGSIDE AVE",19,29,747,900,1,0,1,1,110,79,210,191,10,3,1,5
"2017-10-11",38794,"SEARLE AVE AT WILMONGTON AVE",2211,2161,42,29,0,0,2,0,0,0,53,38,10,8,3,0
"2017-11-07",38856,"NEILSON RD AT OAKMEADOW BLVD (NORTH INTERSECTION)",5431,5497,0,0,0,0,0,0,5,3,0,1,4,5,0,0
"2017-11-08",6472,"ISLINGTON AVE AT LEMSFORD RD & WESTHAMPTON DR",7957,11391,8,1,1,0,0,1,5,49,97,332,1,6,2,1
"2017-11-14",38932,"GREEN MEADOWS CIR AT LESLIE ST",8033,6918,0,0,0,2,0,0,0,0,74,0,0,2,1,0
"2017-11-15",5817,"BLOOR ST W AT LANSDOWNE AVE (PX 326)",2485,3315,0,0,0,0,1,0,1,2,0,0,0,0,0,0
"2017-11-15",32252,"LESLIE ST AT 60M S OF FRANCINE DR (PX 2105)",6465,5732,0,0,0,0,0,0,0,135,0,0,0,0,0,0
"2017-11-29",38933,"AVENUE RD AT HADDINGTON AVE",9249,8569,8,14,1,0,0,1,35,12,449,265,11,7,0,0
"2017-11-29",38935,"AVENUE RD AND FELBRIGG AVE",9433,8869,0,0,0,0,0,0,4,1,456,0,5,1,0,0
"2017-11-29",38937,"CENTENNIAL PARK RD AT RATHBURN RD",0,0,3167,3163,0,0,1,0,58,0,45,3,0,0,6,4
"2017-12-06",12229,"W R ALLEN RD AT HIGHWAY 401 OFF RAMP / YORKDALE RD (PX 1451)",3603,668,1510,0,0,0,2,0,1,5,3,35,0,0,0,1
"2017-12-06",38989,"LESLIE ST AT 1340 LESLIE ST",7685,8332,0,0,0,0,0,0,5,0,0,0,2,2,0,0
"2017-12-09",4980,"EGLINTON AVE AT LLOYD MANOR RD & WIDDICOMBE HILL BLVD (PX 1278)",564,610,6733,6982,0,0,0,0,83,165,186,120,1,1,7,5
"2017-12-12",3958,"HIGHWAY 2A AT KINGSTON RD & HIGHWAY 401 EB OFF RAMP (PX 1202)",308,0,2786,2382,1,0,0,0,52,9,0,1,0,0,0,0
"2017-12-12",6104,"BAYVIEW AVE AT PARKHURST BLVD & SOUDAN AVE",3905,3026,286,182,0,0,0,1,209,8,237,292,0,1,0,3
"2017-12-13",4626,"LAWRENCE AVE E AT GOLDBERRY SQ & PAULANDER AVE",2,1,2657,2295,0,1,0,2,12,9,0,0,0,0,0,1
"2017-12-13",38980,"BELLAMY RD N AT BRIDLINGTON ST",4102,4095,0,0,0,0,0,0,7,24,2,0,0,0,0,0
"2017-12-14",4627,"LAWRENCE AVE E AT BATHGATE DR & CHERRYHILL AVE",15,12,2571,2309,0,1,0,0,19,4,0,1,0,0,0,1
"2017-12-14",6411,"MORTIMER AVE AT WOODYCREST AVE",36,49,2789,3080,0,0,0,0,33,41,23,20,2,3,13,3
"2017-12-14",38985,"AMBERJACK BLVD AT BELLAMY RD N",4262,4222,37,11,0,0,2,0,2,6,53,0,2,1,2,0
"2017-12-20",22714,"HEATH ST W AT TWEEDSMUIR AVE",17,15,1470,1326,0,1,1,1,392,219,151,201,1,3,5,3
"2018-01-09",39026,"ELLERBECK ST AT LN N DANFORTH W ELLERBECK",5,376,0,0,0,0,0,0,44,78,129,339,3,0,0,0
"2018-01-17",39028,"PRINCE EDWARD DR N AT QUEEN MARYS DR 
",1229,1485,17,10,1,0,0,0,5,10,78,55,0,1,0,0
"2018-01-23",11211,"MATHEWS GT AT WALSH AVE (PX 2480)",1,2,4312,6389,1,0,1,0,33,4,3,4,0,0,4,1
"2018-01-23",20494,"KINGSTON RD AT HIGHWAY 401 W/B OFF RAMP (PX 1387)",0,0,6729,6374,0,0,0,0,0,44,32,2,0,0,0,0
"2018-01-24",39032,"LOYALIST RD AT MONTGOMERY RD",0,0,1037,1240,0,0,1,0,12,0,27,18,0,0,0,0
"2018-01-25",4858,"JANE ST AT ST CLAIR AVE (PX 495)",4159,4229,3374,3698,1,2,1,1,157,54,304,122,6,8,5,4
"2018-01-25",5028,"BERNER TR & WICKSON TRL AT NEILSON RD (PX 1474)",5990,5931,105,92,3,2,1,2,126,39,64,37,0,0,0,0
"2018-01-25",5211,"KINGSTON RD AT RYLANDER BLVD (PX 1531)",55,31,5849,5974,3,0,1,0,55,8,0,6,0,0,0,1
"2018-01-25",25914,"MOULD AVE AT ST CLAIR AVE W (PX 2024)",219,13,4225,4667,0,1,0,1,138,354,264,78,2,2,8,3
"2018-01-25",32236,"ADENMORE RD AT CLAPPISON BLVD AT PORT UNION RD (PX 2167)",2691,2750,2,2,2,1,0,0,112,93,126,52,1,2,0,2
"2018-01-25",34791,"CARLAW AVE AT GERRARD ST S INT",3180,2615,0,0,0,0,0,0,0,10,292,0,13,5,1,0
"2018-01-27",4308,"NEILSON RD AT SHEPPARD AVE E",5399,4872,2299,2246,0,0,0,1,183,136,133,121,0,0,2,1
"2018-01-27",4376,"KINGSTON RD AT PORT UNION RD & SHEPPARD AVE E",1838,1222,5199,2947,0,0,0,0,87,35,70,53,0,2,1,0
"2018-01-27",5443,"NEILSON RD AT SEWELLS RD & TAPSCOTT RD (PX 1382)",3804,3584,931,888,2,0,0,0,331,185,213,257,0,0,0,0
"2018-01-30",4389,"EILEEN AVE AT SCARLETT RD (PX 2535)",5003,4451,9,7,0,1,0,0,6,21,89,17,1,2,0,0
"2018-01-30",4396,"OLD ENGLISH LANE AT STEELES AVE E",46,21,9476,9231,0,0,0,0,16,31,70,9,0,0,1,1
"2018-01-30",5476,"BAYVIEW AVE AT GARNIER CRT & NEWTON DR (PX 872)",7984,7531,53,27,0,0,2,1,135,104,278,123,0,0,0,0
"2018-01-30",5500,"BEECROFT RD AT SHEPPARD AVE (PX 1169)",3108,1738,4475,4484,4,1,2,1,400,486,273,197,1,0,0,1
"2018-01-30",39061,"GARNIER CRT AT 355M EAST OF BAYVIEW AVE (DRIVEWAY TO BAYVIEW GTS)",0,0,215,146,0,0,0,0,8,0,0,3,0,0,0,0
"2018-01-30",43238,"BAYVIEW AVE AT 4001 BAYVIEW AVE",8285,7815,0,0,0,0,0,0,0,0,114,0,1,0,0,0
"2018-01-31",4221,"LIVONIA PL AT NEILSON RD & PURPLEDUSK TRL (PX 1778)",4400,3555,6,2,1,1,2,0,27,120,94,33,0,0,0,0
"2018-02-01",39034,"MCNICOLL AVE AT STONEBRIDGE BLVD
",0,0,6399,2386,0,0,0,1,0,25,0,0,0,1,1,1
"2018-02-01",39036,"MOUNT PLEASANT RD AT STIBBARD AVE",5756,6653,5,6,2,1,0,1,0,1,73,82,2,0,0,1
"2018-02-03",4213,"LAWRENCE AVE E AT PHARMACY AVE",2144,2637,7370,6496,0,0,1,1,172,179,117,112,2,2,1,1
"2018-02-03",4834,"HUNTINGWOOD DR AT PHARMACY AVE (PX 1052)",1468,1108,1296,1296,0,0,0,0,18,18,16,19,0,1,0,2
"2018-02-03",5241,"MCNICOLL AVE AT PHARMACY AVE (PX 1241)",1426,1176,2700,2749,0,0,0,0,47,24,26,36,1,1,1,1
"2018-02-06",3990,"PHARMACY AVE AT ROSSCOWAN GT / FAIRGLEN SCHOOL (PX 1753)",3758,2459,4,5,0,1,0,0,53,49,44,141,4,2,1,1
"2018-02-06",4213,"LAWRENCE AVE E AT PHARMACY AVE",3232,3825,9035,6993,1,0,2,2,404,273,224,339,0,0,0,2
"2018-02-06",4629,"# 1315 NEILSON RD AT NEILSON RD & 175M N OF TAPSCOTT RD (PX 1658)",4777,5019,0,0,0,0,0,0,393,245,188,0,0,0,0,0
"2018-02-06",4835,"COLLINGSBROOK BV AT CORINTHIAN S BLVD & PHARMACY AVE (PX 1520)",3443,2109,127,104,0,0,2,0,46,251,72,137,3,2,0,1
"2018-02-06",6023,"BEVERLY GLEN BLVD AT CHESTER LE BLVD & PHARMACY AVE (PX 1633)",3653,2338,113,131,1,2,0,0,46,16,27,30,4,3,1,0
"2018-02-06",13052,"CORINTHIAN BLVD N AT PHARMACY AVE & PINEMEADOW BLVD (PX 1465)",3434,2164,238,210,1,0,1,1,71,65,189,160,4,5,1,1
"2018-02-06",32793,"ARNALL AVE AT PHARMACY AVE (PX 2216)",4273,3198,0,0,0,1,0,0,28,14,35,0,4,0,0,0
"2018-02-06",33852,"PHARMACY AVE AT 305M N OF HUNTINGDALE BLVD/ CHESTER LE (PX 2234)",3895,2561,0,0,0,0,0,1,4,3,0,51,1,1,0,1
"2018-02-06",39063,"COXWELL AVE AT LN N OF DANFORTH E OF COXWELL",0,0,0,0,0,0,0,0,2,0,101,79,0,0,0,0
"2018-02-08",4448,"BOLSTER AVE AT NANCY AVE & PHARMACY AVE (PX 2170)",2601,2892,11,1,0,0,2,0,239,28,277,65,0,0,0,0
"2018-02-08",4833,"CHESTER LE BLVD AT HUNTINGDALE BLVD & PHARMACY AVEC (PX 1240)",3449,2253,243,273,1,0,0,2,133,141,84,157,2,1,1,2
"2018-02-08",12259,"DOLPHIN DR AT PHARMACY AVE (PX 1870)",2247,2231,5,2,0,0,0,1,395,24,109,64,0,0,0,0
"2018-02-08",30409,"KNIGHTSBRIDGE RD AT PHARMACY AVE (PX 2125)",5246,4860,0,0,0,0,0,1,109,115,0,45,0,1,0,0
"2018-02-08",39040,"MOUNT PLEASANT RD AT SHELDRAKE BLVD",5349,6931,1,4,0,0,1,1,1,7,76,165,1,3,1,0
"2018-02-15",5943,"EMPRESS AVE AT WILLOWDALE AVE (PX 1136)",3366,2524,1079,1082,0,0,0,1,56,78,49,42,1,0,3,3
"2018-02-15",39070,"CHURCH AVE AT WILLOWDALE AVE (PX 2533)",3761,2893,46,61,1,0,1,1,25,28,66,51,6,0,0,1
"2018-02-20",30884,"FELSTEAD AVE AT MONARCH PARK AVE",0,0,230,171,1,0,2,0,81,0,34,37,4,2,7,3
"2018-02-21",39064,"COPELAND AVE AT ROSEHEATH AVE",107,85,0,0,0,1,2,0,36,22,66,0,0,1,1,0
"2018-02-22",39065,"EASTERN AVE AT WOODFIELD RD (PX 2605)",7,0,3485,3520,5,0,0,1,105,69,15,6,9,3,10,6
"2018-02-27",5239,"INNISWOOD DR AT PHARMACY AVE (PX 1411)",5340,6171,0,0,0,0,0,0,200,72,0,83,2,6,1,0
"2018-02-27",5240,"BRIAN AVE AT PHARMACY AVE (PX 1187)",4143,4807,0,0,0,0,1,0,168,269,102,0,2,4,0,2
"2018-02-27",28950,"BISCAYNE BLVD AT PHARMACY AVE & SINGLETON RD (PX 2229)",5026,6015,4,8,2,0,0,0,14,48,63,72,3,11,5,1
"2018-02-27",32674,"INNISDALE DR AT PHARMCAY AVE (PX 2227)",5205,6100,0,0,0,0,0,1,6,60,46,61,3,2,0,1
"2018-02-27",36658,"PHARMACY AVE AT 115M NORTH OF RANNOCK ST (PX 2268)",5434,6328,0,0,0,0,0,0,19,10,0,0,5,7,0,0
"2018-02-27",39068,"WALBON RD. AT WARDEN AVE",7619,7020,0,0,1,0,0,0,4,0,0,43,8,8,0,0
"2018-02-28",4586,"BATHURST ST AT JOICEY BLVD & MARQUETTE AVE (PX 318)",8607,8444,28,24,0,1,1,1,334,331,284,391,8,8,3,1
"2018-02-28",5049,"BYNG AVE AT WILLOWDALE AVE (PX 1772)",3847,2835,120,82,0,0,0,0,27,65,135,93,8,3,1,4
"2018-02-28",6394,"EVANS AVE AT TREEVIEW DR (PX 2250)",1,0,5280,5113,3,0,0,0,19,41,20,13,0,1,5,4
"2018-02-28",39099,"TTC LOT 70M NORTH OF BISHOP AVE AT WILLOWDALE AVE",5378,4071,0,0,0,0,0,0,7,0,0,61,4,6,0,0
"2018-03-01",4449,"DEWEY DR AT PHARMACY AVE (PX 1882)",4113,4889,76,133,1,2,1,0,38,113,73,112,5,2,0,0
"2018-03-01",39102,"WILSON AVE AT 50M WEST OF MURRAY RD (#945 WILSON AVE)",0,0,6916,8236,0,0,0,0,0,77,0,0,0,0,6,3
"2018-03-03",4535,"BURNHAMTHORPE RD AT HIGHWAY 427 E TCS (PX 949)",0,0,4612,7317,0,1,0,0,0,78,1,1,0,0,4,2
"2018-03-06",5745,"BURNHAMTHORPE RD AT KIPLING AVE (PX 726)",4131,4574,4111,4241,0,0,1,0,27,127,39,60,1,1,1,3
"2018-03-06",5935,"CALEDONIA RD AT LAWRENCE AVE (PX 427)",2537,2314,4884,5528,3,1,0,2,217,265,213,321,4,5,4,0
"2018-03-06",39105,"BURNHAMTHORPE RD AT 65M WEST OF LAUREL AVE (PX 2336)",0,0,6440,7317,0,0,0,0,0,0,30,0,0,0,0,3
"2018-03-08",5652,"CALEDONIA RD AT RAITHERM RD & HOME DEPOT (PX 1868)",4331,4013,42,29,0,0,0,0,27,129,88,57,10,12,4,0
"2018-03-08",5836,"CALEDONIA RD AT KITCHENER AVE (PX 796)",3587,4339,43,64,0,1,0,0,68,89,48,117,5,9,1,0
"2018-03-08",26353,"BENTWORTH AVE AT CALEDONIA RD (PX 2063)",3919,2970,26,36,0,0,1,0,48,58,102,37,6,3,0,0
"2018-03-13",4340,"CHIPPING RD AT DON MILLS RD (PX 1045)",8006,7019,0,0,0,2,0,0,74,2,98,0,0,2,1,0
"2018-03-15",39104,"CLOCK TOWER RD AT DON MILLS RD",7616,5925,0,0,1,0,0,1,90,173,0,87,0,0,0,0
"2018-03-19",12140,"BIRCHMOUNT RD AT ROLARK DR",7074,6276,0,0,0,0,0,0,0,10,0,44,6,9,0,0
"2018-03-20",39098,"CANONGATE TRL AT OCKWELL MANOR DR (SOUTH INTERSECTION)",715,717,0,0,0,0,1,0,21,13,2,0,8,5,0,0
"2018-03-21",6216,"DON MILLS RD AT KERN RD",10671,8200,0,0,0,0,0,0,41,0,37,78,4,4,0,0
"2018-03-21",39096,"BIRCHMOUNT RD AT PARNELL AVE",2697,2747,0,0,0,0,0,0,31,19,0,0,6,5,4,0
"2018-03-21",39157,"PARKDALE RD. AT SUNNYSIDE AVE",583,757,0,0,0,0,0,0,21,47,0,395,0,0,0,0
"2018-03-22",5944,"CUMMER AVE AT WILLOWDALE AVE (PX 806)",4594,3610,1943,2196,0,0,0,0,117,164,106,99,3,3,2,3
"2018-03-22",34936,"CUMBER AVE AT FORDOVER DR AND MORNINGSIDE AVE",1049,907,45,23,2,0,2,0,118,11,47,24,1,1,2,0
"2018-03-24",4771,"HIGHWAY 27 AT STEELES AVE W",3842,3731,4481,4597,0,1,1,2,4,13,2,10,0,0,0,1
"2018-03-24",4807,"ALBION RD AT HIGHWAY 27 (PX 1164)",4178,4038,3699,3955,0,1,0,0,10,21,35,5,0,0,7,0
"2018-03-24",4969,"CALEDONIA RD AT EGLINTON AVE (PX 465)",2888,2520,3268,2921,0,0,0,0,257,421,402,395,13,6,1,2
"2018-03-24",5837,"CALEDONIA RD AT CASTLEFIELD AVE (PX 797)",2899,3229,2484,2573,0,0,0,0,38,38,81,39,3,3,4,2
"2018-03-24",5935,"CALEDONIA RD AT LAWRENCE AVE (PX 427)",2244,2475,4485,4809,0,0,0,0,117,159,126,225,3,1,1,1
"2018-03-24",12140,"BIRCHMOUNT RD AT ROLARK DR",5989,5483,0,0,0,0,0,0,1,10,0,63,4,3,0,0
"2018-03-29",13448,"NORTHCLIFFE BLVD AT ROSECLIFFE AVE",358,0,180,134,0,0,0,0,36,58,15,44,8,2,3,7
"2018-03-29",13562,"CLOVERLAWN AVE AT NORTHCLIFFE BLVD",560,0,194,66,0,0,0,0,74,85,63,98,14,2,3,3
"2018-03-29",23335,"OAKWOOD AVE AT ROSEMOUNT AVE (PX 2524)",2508,2145,514,418,0,1,0,0,20,188,131,190,16,12,6,6
"2018-03-29",29079,"BAYVIEW AVE AT RIVER ST (PX 177)",2738,2770,0,0,5,0,0,2,0,2,0,0,5,14,6,0
"2018-03-29",32789,"EARLSDALE AVE AT OAKWOOD AVE",3989,3841,0,0,0,0,0,0,73,41,403,307,19,12,9,1
"2018-03-29",39145,"GREENLAW AVE AT ROSEMOUNT AVE",342,197,0,0,0,0,0,0,37,23,124,0,2,1,0,2
"2018-03-29",39150,"DUNDURN CRES AT WINONA DR",0,1,211,0,1,0,0,0,55,52,24,49,28,8,4,4
"2018-04-03",4022,"EAST DR AT JANE ST & OUTLOOK AVE (PX 526)",6000,6092,164,284,1,0,0,0,148,166,140,203,3,3,4,0
"2018-04-03",6034,"JANE ST AT JOHN ST (PX 943)",7883,8027,18,14,2,0,0,0,230,138,352,297,7,3,0,3
"2018-04-03",6036,"HARDING AVE AT JANE ST (PX 1318)",7128,7413,0,0,0,0,2,0,55,150,427,0,2,3,0,0
